resume_text,skills
contact ibropamela@gmail.com +44 7383 151 935 top skills microsoft office package communication skills written and verbal problem solving time management conflict resolution organisation skills customer service teamwork interpersonal skills attention to detail. calm under pressure. knowledge of hris fourth and adp. knowledge of booking systems opentable and seven rooms. languages english advanced pamela kreku hr assistant at bill s restaurant. hr assistant at canary riverside plaza hotel cipd level 3 certificate in people practice. summary an organized results-oriented customer service professional with an excellent track record of significantly increasing service quality sales and customer base. outstanding communication relationship-building and influencing skills competent in building customer relationships which inspire confidence and loyalty. a highly efficient individual with extensive team leadership experience able to adapt well to new environments and learn new processes quickly to achieve outstanding results. strong ability to multi-task priorities and organize. highly resourceful flexible innovative and enthusiastic individual who possesses a considerable amount albanian native or bilingual of knowledge regarding administrative and office procedures coupled with good it skills and ability to communicate confidently at all levels. a quick learner who can absorb new ideas as well as organised and an excellent team player committed and motivated with exceptional client service and decision-making skills. strong work ethic professional demeanour and great initiative with a proven ability to work proactively in a complex and busy office environment. certifications excel 2016 essential training admin secretarial skills level 7 diploma in hr management endorsed diploma cefr c1 advanced english score british council jul 2020 cpd level 3 award in admin and secretarial skills oplex careers jan 2020 - mar 2020 level 7 diploma in hr management endorsed diploma cipd level 3 foundation certificate in people practice. first aid training certificate. diversity and inclusion certificate. education london southeast colleges business administration gcse high school diploma besnik sykja tirana albania london southeast colleges esol skills for life verbal and written experience human resources administrator at canary riverside plaza hotel february 2023 present london england united kingdom acting as first point of contact for a range of hr queries escalating where required. managing processes e.g. maternity paternity and flexible working drafting letters and briefing employees on processes. preparing management reports as required e.g. absence and employee turnover. working with the people director and managers to put in place core strategic processes such as an effective appraisal system to support employee retention. processing payroll each pay period. assisting with recruitment such as advertising jobs on the recruitment platform and attending interviews. acting as note taker where required. delivering ad hoc projects as requested by the people director and managers. acting as administrator for a range of people-focused systems. assisting in the new starter on-boarding process including checking right to work documents and drafting contracts and letters. a variety of hr administrative tasks such as responding to requests for references. conducting file audits and keeping files up to date. coordinating and setting up meetings. administration of staff benefits. reservations administrator at d d london october 2022 february 2023 london england united kingdom respond to guests queries in a timely and accurate way via phone or email. identify guest needs and help customers use specific features. monitor customer complaints and reach out to provide assistance. follow up with guests to ensure their requests are resolved. inform guests about new features and functionalities. human resources assistant at bill s march 2022 september 2022 london england united kingdom acting as first point of contact for a range of hr queries escalating where required. managing processes e.g. maternity paternity and flexible working drafting letters and briefing employees on processes. preparing management reports as required e.g. absence and employee turnover. working with the people director and managers to put in place core strategic processes such as an effective appraisal system to support employee retention. working with the payroll manager to ensure the accurate processing of payroll each pay period. acting as note taker where required. delivering ad hoc projects as requested by the people director and managers. acting as administrator for a range of people-focused systems. assisting in the new starter on-boarding process including checking right to work documents and drafting contracts and letters. a variety of hr administrative tasks such as responding to requests for references. conducting file audits and keeping files up to date. coordinating and setting up meetings. administration of staff benefits. reservations agent at bill s november 2021 march 2022 london england united kingdom respond to customer queries in a timely and accurate way via phone email or chat. identify customer needs and help customers use specific features. analyze and report product malfunctions for example by testing different scenarios or impersonating users update our internal databases with information about technical issues and useful discussions with customers. monitor customer complaints and reach out to provide assistance. share feature requests and effective workarounds with team members. inform customers about new features and functionalities. follow up with customers to ensure their requests are resolved. gather customer feedback and share with our product sales and marketing teams. assist in training junior customer support representatives receptionist at haz restaurant group may 2021 march 2022 london england united kingdom draw up client bookings for tables and ensure that tables are set before client s arrival manage the front desk by receiving incoming calls greeting and attending to customers inform guests about the availability of tables and direct them to the tables keep records of guests who visit the restaurant assist customers with answers to queries and proffer solutions to issues within my capacity collaborate with other restaurant staff and the management to ensure that customer complaints are properly attended to in a timely manner ensure that clients make payment for services before they exit the restaurant keep clear records of payments received and make detailed notes of balance payments check restaurant s emails to respond to them accordingly communicate with other staff informing them of client s booking needs and complaints undertake any other reasonable duties necessary to ensure the smooth running of the service. receptionist / supervisor at knights enterprise ltd january 2017 april 2021 london england united kingdom ensured properties were well maintained and ready for guests holidays carried out inspections of properties where appropriate helped resolve and negotiate customer complaints to a pleasant resolution. answered enquiries from customers converted enquiries to bookings where possible managed the administration of relevant correspondence and dealt with payments. assisted with our marketing strategy providing content and ideas for our website. restaurant server / customer service assistant at albertini restaurant january 2015 december 2016 london england united kingdom i maintained high standards of customer service during high-volume fast-paced operations communicate clearly and positively with co-workers and management assisted management with inventory control and stock ordering built loyal clientele through friendly interactions and consistent appreciation resolved complaints promptly and professionally and cross-train and coordinated scheduling with team members to ensure seamless service. during my experience i have also mastered point-of-service pos computer systems for automated order taking as well as taken initiative to find extra tasks when scheduled duties were completed.,"microsoft office, hris, adp, opentable, seven rooms"
abhiraj chaudhuri +91 74900 14224 abhirajchaudhuri@gmail.com linkedin.com/in/abhirajc github.com/abhie7 summary passionate about delving into the realms of ai/ml data science and statistics. enthusiastic about cultivating expertise in machine learning algorithms and ai applications for impactful solutions. projects terrain classifier vision transformers pytorch opencv torchvision tinkerthon hackathon 2.0 compiled a custom dataset including drone and satellite images of forests deserts and mountains using web and manual scraping utilized vision transformers vit treating images as patch sequences for improved landscape pattern recognition trained model with augmented dataset optimizing parameters for minimal loss function ensuring accurate predictions achieved 97 accuracy through rigorous training validating model s effectiveness in terrain recognition secured first runner s up position in the hackathon reflecting exceptional team collaboration scientific document parser and chat python flask mistral 7b langchain rag mined 2024 hackathon implemented a document search and chat web application using flask python and mistral 7b developed parsers for pdf pptx docx tex html and txt file types implementing chunking for efficient data processing integrated ocr for extracting text from images in documents alongside image captioning algorithms collaborated with team members to plan and execute tasks gaining valuable problem-solving experience student management system php mysql apache xampp server personal project developed a web application using php and mysql applying session management protocols implemented user authentication with login functionality including options for password recovery designed an intuitive dashboard interface to effortlessly manage student records incorporating pagination provided functionalities for adding editing and deleting student records directly from the dashboard with real-time updates reflected in the mysql database created a user management section exclusively accessible to administrators enabling management of system users skills programming languages python javascript java backend technologies flask django node.js data science statistics numpy pandas matplotlib seaborn pytorch opencv neural networks frontend technologies html5 css3 reactjs databases sql mysql mongodb developer tools git github aws vs code visual studio dsa design tools figma adobe photoshop adobe illustrator canva interpersonal skills leadership quick grasping problem solving team collaboration education navrachana university bachelor of computer applications 9.09 cgpa navrachana higher secondary school cbse class xii humanities 84 professional certifications aws academy machine learning foundations aws academy graduate aws academy introduction to cloud semester 1 aws academy graduate web development internshala trainings vadodara gujarat august 2022 may 2025 vadodara gujarat may 2020 june 2022 issued march 2024 issued december 2023 issued may 2020,"python, javascript, java, flask, django, node.js, numpy, pandas, matplotlib, seaborn, pytorch, opencv, html5, css3, reactjs, sql, mysql, mongodb, git, github, aws, vs code, visual studio"
manjunath email manjunathjava261@gmail.com mobile 8197550306 career objective to secure a challenge in a position where i can effectively contribute my skills as a software professional possessing competent technical skills. professional summary having 4 years of it experience in developing web and enterprise application using java/j2ee spring and hibernate. good knowledge of object-oriented programming concepts. hands-on experience in core java jdbc servlets jsp javascript and hibernate. strong hands-on experience in implementing design patterns like mvc singleton data access object dto service façade delegate and factory. having experience with configuration management tools like svn cvs rtc. hands-on experience in spring spring boot micro services hibernate and frame works. hands on experience build tool like maven. hands-on experience in sql databases. good team member positive attitude and result oriented self-motivated quick learner willing to adapt to new challenges new technologies web services spring and hibernate . academic details completed mba-2017 from reddy jana sangha institute management studies college bangalore university. completed bsc-2015 from mahaveer university. professional experience working as a software engineer in incedo technologies from april 2019 to till date. technical skills programming languages jse technologies jee technologies web technologies frame works java jdbc servlets and jsp html css and java script spring struts hibernate spring boot micro services web service soap restful framework modules core module spring orm spring mvc. database web server ide operating system others sql tomcat web logic web sphere eclipse windows family ms office linux sql soap web services jax-ws restful tools project-3 title client role duration log4j maven svn repository j unit. easy pod connect merck serono geneva uk. java/j2ee developer. oct 2021 to till date. description the easy pod connects software web application allows the saizen injection data to be accessed with the consent of the patient through a secure web page. the application provides the healthcare professional user with reports and graphical representations of the injection history to facilitate the monitoring and clinical analysis of patients treatment adherence and outcome. the easy pod connects online module supports data transfer from the easy pod medical device to a local pc. the application shall support both the easy pod 1 and 2 devices. when the patient takes the injection using easy pod 2 device the injection data shall be transmitted either through wtt wireless telecommunication technology or through usb port in a secured manner. responsibilities involved in the designing of activities. involved to implement the restful web services. participated onsite discussion for the requirement gathering. analyze the system requirements writing the business logic for a given activity. doing the code reviews. test the developer test cases and doing the unit testing coordinated the onsite offshore teams for requirements development deployment and delivery. working with agile methodology using jira tool implemented jpa components. environment core java html java script jquery css spring spring boot micro services hibernate restful web service mysql server tomcat maven. project 2 client project title role duration description acapulco iusa cell mexico java/j2ee programmer. aug 2020 to sep 2021 acapulco is #3 among mexico mobile service providers. the company provides cellular services reaching about 90 of mexico s population including mexico city and received more licenses to cover the remaining regions in early 2005. it has more than 3.5 million subscribers 67 are prepaid equivalent to approximately 7 of the wireless telecommunications market in mexico. the company also offers local and long-distance telephony messaging services mobile television and wireless broadband services bam over the only 3g nation-wide network in mexico. in 2010 based on ibm s experience with complex telco accounts large-scale transformations and leadership in best practices acapulco entered into a strategic outsourcing deal to let ibm manage its overall it infrastructure and facilitate the company s rapid business growth. a set of programs were targeted with the objective to prioritize the reduction of existing churn and effect increased market share. the acapulco enterprise has been broadly categorized into separate functional domains consistent with telecom management forum s etom domains and tam applications framework. additional domains for sdp and network service were added to capture the complete scope of iusa cell s infrastructure. the acapulco account includes environment j2se and j2ee spring spring boot hibernate web services micro services html css javascript jsp eclipse ide maven log4j svn repository j unit sql database. implementation of web pages in jsp using spring form tag library. involved in developing jsp forms and navigation using view resolver. responsibilities used spring framework for dependency injection. used spring hibernate for querying data from the database. develop the site and integrating the dynamic pages with the static designs. involved in developing controllers using spring mvc. implementation of web pages in jsp using java script for validations. implementation of web pages using jsp and html. implement the code as per design. developed the business logic. project 1 client title position duration description health information system his java/j2ee programmer april 2019 to july 2020 dhis 2.0 is a web-based version of ms based software dhis 1.0. the purpose of dhis 2.0 is to improve the quality of health facilities by integrating various types of data and reporting from different health programs within the district health system and to provide tools to districts managers to analyze their local information. dhis 2.0 provides solution by establishing a database where data from all facilities health programs demographic data infrastructure data and personnel data registered and managed. managers could then get comprehensive reports correlating data from various sources. environment j2se and j2ee spring spring boot hibernate web services micro services html css javascript jsp eclipse ide maven log4j svn repository j unit sql database. responsibilities involved in the designing of activities. involved to implement the restful web services. participated in discussions with the onsite team analyze the system requirements writing the business logic for a given activity. doing the code reviews. test the developer test cases and doing the unit testing coordinated the onsite offshore teams for requirements development deployment and delivery. implemented hibernate components.,"java, j2ee, spring, hibernate, jdbc, servlets, jsp, javascript, html, css, maven, svn, cvs, rtc, sql, tomcat, weblogic, websphere, eclipse, windows, linux, ms office, log4j, junit, restful, soap, jax-ws, microservices, spring boot, struts, hibernate, spring orm, spring mvc, jpa, jquery"
